nome,categoria,preco,dimensoes,peso,descricao,imagem
Sofá 3 Lugares Premium,Sala de Estar,1200.00,2.10m x 0.90m x 0.85m,45kg,Sofá confortável para sala com tecido premium,https://exemplo.com/sofa.jpg
Mesa de Jantar 6 Lugares,Sala de Jantar,890.50,1.60m x 0.90m x 0.75m,35kg,Mesa em madeira maciça para 6 pessoas,
Cama Box Casal,Quarto,750.00,1.88m x 1.38m x 0.60m,55kg,Cama box casal com colchão incluído,
Guarda-Roupa 3 Portas,Quarto,650.00,1.35m x 0.52m x 1.80m,68kg,Guarda-roupa espaçoso com 3 portas,
Poltrona Reclinável,Sala de Estar,420.00,0.85m x 0.95m x 1.05m,28kg,Poltrona confortável com sistema reclinável,